"","job_id","jobbank..Job.Title.","industry","jobdesc"
"146",146,"Senior Data Scientist","Insurance, Internet - ECommerce","POSITION SUMMARY Looking for opportunities to use cutting edge technologies analyzing petabytes of data in a world class Hadoop cluster, generating insights to guide consumers in their journey to wellness and help them achieve their health ambitions, whether its running the Inca Trail Marathon or playing tackle football with their grandkids? Aetna's Member Analytics team is focused on delivering strategically-impactful programs and tools to help members across all life stages feel the joy of achieving their best health, in their own way. This position will work within a cross-functional team, delivering predictive analytics solutions to drive customer engagement and next-best-action, and improve customer experience across critical journeys, e.g., onboarding, breast cancer, maternity. The candidate will be responsible for extracting and manipulating data from multiple, large data sources and using the data to deliver predictive model and solutions to drive member behavior change and experience across channels (mobile app, web, email, social, call center, Apple).Fundamental ComponentsDevelops and/or uses advanced algorithms and statistical predictive models and determines analytical approaches and modeling techniques to evaluate scenarios and potential future outcomes. Uses strong programming skills to explore, analyze and interpret large volumes of data in various forms, and solve complex business problems. Supports deployment of insights across multiple channels, i.e., web, mobile app, email, social, call center, Apple watch. Demonstrates strong ability to communicate technical concepts and implications to peers, managers, and business partners.BACKGROUND/EXPERIENCE desired5 or more years of progressively complex related experience. Demonstrates proficiency in most areas of mathematical analysis methods, machine learning, statistical analyses, and predictive modeling and in-depth specialization in some areas. Expertise in using R or Python to manipulate large data sets and develop statistical models. Expertise in data management in an Hadoop environment, including use of Hive. Excellent problem solving skills, critical thinking and conceptual thinking abilities. Strong ability to communicate technical concepts and implications to business partners. Some knowledge of health care industry preferred.EDUCATION The highest level of education desired for candidates in this position is a Master's degree. ADDITIONAL JOB INFORMATION Aetna is about more than just doing a job. This is our opportunity to re-shape healthcare for America and across the globe. We are developing solutions to improve the quality and affordability of healthcare. What we do will benefit generations to come. We care about each other, our customers and our communities. We are inspired to make a difference, and we are committed to integrity and excellence. Together we will empower people to live healthier lives. Aetna is an equal opportunity & affirmative action employer. All qualified applicants will receive consideration for employment regardless of personal characteristics or status. We take affirmative action to recruit, select and develop women, people of color, veterans and individuals with disabilities. We are a company built on excellence. We have a culture that values growth, achievement and diversity and a workplace where your voice can be heard. Aetna is about more than just doing a job. This is our opportunity to re-shape healthcare for America and across the globe. We are developing solutions to improve the quality and affordability of healthcare. What we do will benefit generations to come. We care about each other, our customers and our communities. We are inspired to make a difference, and we are committed to integrity and excellence. Together we will empower people to live healthier lives. Aetna is an equal opportunity & affirmative action employer. All qualified applicants will receive consideration for employment regardless of personal characteristics or status. We take affirmative action to recruit, select and develop women, people of color, veterans and individuals with disabilities. We are a company built on excellence. We have a culture that values growth, achievement and diversity and a workplace where your voice can be heard. Benefit eligibility may vary by position. Click here to review the benefits associated with this position. Aetna takes our candidates's data privacy seriously. At no time will any Aetna recruiter or employee request any financial or personal information (Social Security Number, Credit card information for direct deposit, etc.) from you via e-mail. Any requests for information will be discussed prior and will be conducted through a secure website provided by the recruiter. Should you be asked for such information, please notify us immediately.Aetna is an Equal Opportunity, Affirmative Action Employer"
"147",147,"Data Scientist","Consulting, Healthcare - Health Services, Insurance","POSITION SUMMARY This position will work within a cross-functional team, delivering predictive analytics solutions to drive customer engagement and next-best-action, and improve customer experience across critical journeys, e.g., onboarding, breast cancer, maternity. The candidate will be responsible for extracting and manipulating data from multiple, large data sources and using the data to deliver predictive model and solutions to drive member behavior change and experience across channels (mobile app, web, email, social, call center, Apple)Fundamental Components:• Develops and/or uses advanced algorithms and statistical predictive models and determines analytical approaches and modeling techniques to evaluate scenarios and potential future outcomes• Uses strong programming skills to explore, analyze and interpret large volumes of data in various forms, and solve complex business problems• Supports deployment of insights across multiple channels, i.e., web, mobile app, email, social, call center, Apple watch• Demonstrates strong ability to communicate technical concepts and implications to peers, managers, and business partnersBACKGROUND/EXPERIENCE desired:• 2-3 or more years of progressively complex related experience• Demonstrates proficiency in most areas of mathematical analysis methods, machine learning, statistical analyses, and predictive modeling and in-depth specialization in some areas.• Expertise in using R or Python to manipulate large data sets and develop statistical models• Expertise in data management in an Hadoop environment, including use of Hive• Excellent problem solving skills, critical thinking and conceptual thinking abilities• Strong ability to communicate technical concepts and implications to business partners• Some knowledge of health care industry preferredEDUCATION The highest level of education desired for candidates in this position is a Master's degree. ADDITIONAL JOB INFORMATION Aetna is about more than just doing a job. This is our opportunity to re-shape healthcare for America and across the globe. We are developing solutions to improve the quality and affordability of healthcare. What we do will benefit generations to come. We care about each other, our customers and our communities. We are inspired to make a difference, and we are committed to integrity and excellence. Together we will empower people to live healthier lives. Aetna is an equal opportunity & affirmative action employer. All qualified applicants will receive consideration for employment regardless of personal characteristics or status. We take affirmative action to recruit, select and develop women, people of color, veterans and individuals with disabilities. We are a company built on excellence. We have a culture that values growth, achievement and diversity and a workplace where your voice can be heard. Aetna is about more than just doing a job. This is our opportunity to re-shape healthcare for America and across the globe. We are developing solutions to improve the quality and affordability of healthcare. What we do will benefit generations to come. We care about each other, our customers and our communities. We are inspired to make a difference, and we are committed to integrity and excellence. Together we will empower people to live healthier lives. Aetna is an equal opportunity & affirmative action employer. All qualified applicants will receive consideration for employment regardless of personal characteristics or status. We take affirmative action to recruit, select and develop women, people of color, veterans and individuals with disabilities. We are a company built on excellence. We have a culture that values growth, achievement and diversity and a workplace where your voice can be heard. Benefit eligibility may vary by position. Click here to review the benefits associated with this position. Aetna takes our candidates's data privacy seriously. At no time will any Aetna recruiter or employee request any financial or personal information (Social Security Number, Credit card information for direct deposit, etc.) from you via e-mail. Any requests for information will be discussed prior and will be conducted through a secure website provided by the recruiter. Should you be asked for such information, please notify us immediately.Aetna is an Equal Opportunity, Affirmative Action Employer

Job Requirements

POSITION SUMMARY This position will work within a cross-functional team, delivering predictive analytics solutions to drive customer engagement and next-best-action, and improve customer experience across critical journeys, e.g., onboarding, breast cancer, maternity. The candidate will be responsible for extracting and manipulating data from multiple, large data sources and using the data to deliver predictive model and solutions to drive member behavior change and experience across channels (mobile app, web, email, social, call center, Apple)Fundamental Components:• Develops and/or uses advanced algorithms and statistical predictive models and determines analytical approaches and modeling techniques to evaluate scenarios and potential future outcomes• Uses strong programming skills to explore, analyze and interpret large volumes of data in various forms, and solve complex business problems"
"148",148,"Senior Statistician Clinical Development","Other Great Industries","The statistician serves as a representative of the Biostatistics platform on clinical teams and is responsible for leading the development of a product from the platform standpoint.   He/she takes a leadership role in projects up to and including participation in the preparation of a dossier for submission.  He/she also may represent the Biostatistics platform at external meetings with regulatory agencies and key opinion leaders.Key accountabilities:- Acts as lead statistician for small to large projects, including complex designs and/or efficacy/effectiveness.- May participate as lead statistician in dossier submission preparation- Manages and follows-up the activities that are outsourced to external partners, including submissions- Participates and provides statistical support in the preparation of major decision-making meetings- Completes statistical section of the clinical study report and provides a critical review- Ensures accuracy of statistical methods (SAPs, sample size estimation, study design, randomization) and statistical analysis results through review and validation- Participates in discussions and writing of Clinical Development PlansBasic Qualifications /Requirements:- Minimum of a Masters degree (Statistics , Applied Statistics, Mathematics, Data Analytics, or similar field of study) AND- 5+ years of experience in the pharmaceutical/biotech industry.- Demonstrated experience with SAS software and awareness of current features of SAS;  this includes the use of SAS Base, Statistics, and Graphics. The successful candidate will also possess the following skills:- Ability to work in a multidisciplinary and international team. - Very good oral and written communication skills.- Ability to lead a project(s) while providing supervision of others - Dossier submission experience- Experience providing strategic input to Study design and Clinical Development Plans Sanofi US Services, Inc. and its U.S. affiliates are Equal Opportunity and Affirmative Action employers committed to a culturally diverse workforce.  All qualified applicants will receive consideration for employment without regard to race; color; creed; religion; national origin; age; ancestry; nationality; marital, domestic partnership or civil union status; sex, gender, gender identity or expression; affectional or sexual orientation; disability; veteran or military status or liability for military status; domestic violence victim status; atypical cellular or blood trait; genetic information (including the refusal to submit to genetic testing) or any other characteristic protected by law.#LI-SPSanofi is dedicated to supporting people through their health challenges. We are a global biopharmaceutical company focused on human health. We prevent illness with vaccines, provide innovative treatments to fight pain and ease suffering. We stand by the few who suffer from rare diseases and the millions with long-term chronic conditions.With more than 100,000 people in 100 countries, Sanofi is transforming scientific innovation into healthcare solutions around the globe.Sanofi, Empowering Life"
"149",149,"AWS Big Data Scientist - New York - $150K","Computer Hardware, Computer Software","AWS Big Data Scientist - New York - $150KOne of my clients in the New York area is looking to hire an experienced AWS Big Data Scientist. This candidate should have hands on experience with coding, analytics, and predictive models. They should also have hands on experience with the Hadoop Ecosystem. If you are interested, please review the following requirements below and apply!AWS Big Data Scientist - New York - $150K Requirements:Experience in SQL and relational databases
Experience with coding language Python
Hands on with Big Data tools such as: Hadoop, Hive, Spark
Knowledge of AWS
Experience with predictive analytics and data science
Hands on with predictive modeling and machine learning projects
Benefits:Fully paid medical/dental/vision insurance
Work remote
401K with company match
Competitive base salary with bonus
If you are interested in this position, please call me (Ericka Styles) at 212-731-8282 or simply send me your resume to my email address - [Click Here to Email Your Resumé]. Act fast, as this opportunity will most likely be off the market in the near future.I understand the need for discretion and would welcome the opportunity to speak to any Big Data and cloud analytics candidates that are considering a new career or job either now or in the future. Confidentiality is of the upmost importance. For more information on available BI jobs, as well as the Business Intelligence, Big data and cloud market, I can be contacted at 212-731-8282. Please see www.jeffersonfrank.com for more information.Big Data / Data Science / Hadoop / Microsoft Business Intelligence / BI / Business Intelligence / SSRS / SSAS / SSIS / SQL / T-SQL / MDX / Azure / Cloud / AWS / Data Warehouse / ETL / Power BI / Architect / Big Data / Hadoop / Scala / Python / Apache / Hive / Spark / Data Science / Analytics / Predictive Modelling / New York / New Jersey

Job Requirements

Big Data / Data Science / Hadoop / Microsoft Business Intelligence / BI / Business Intelligence / SSRS / SSAS / SSIS / SQL / T-SQL / MDX / Azure / Cloud / AWS / Data Warehouse / ETL / Power BI / Architect / Big Data / Hadoop / Scala / Python / Apache / Hive / Spark / Data Science / Analytics / Predictive Modelling / New York / New Jersey"
"150",150,"Data Scientist/Analyst, Lead","Consulting","Job Number: R0036859Data Scientist/Analyst, LeadThe Challenge:Are you excited at the prospect of unlocking the secrets held by a data set? Are you fascinated by the possibilities presented by the IoT, machine learning, and artificial intelligence advances? In an increasingly connected world, massive amounts of structured and unstructured data open up new opportunities. As a data scientist, you can turn these complex data sets into useful information to solve global challenges. Across private and public sectors — from fraud detection, to cancer research, to national intelligence — you know the answers are in the data. We have an opportunity for you to use your leadership and analytical skills to improve a client's ability to make informed decisions to support their mission. You’ll work closely with your customer to understand their questions and needs, then dig into their data-rich environment to find the pieces of their information puzzle. You’ll mentor teammates and use the right combination of tools and frameworks to turn that set of disparate data points into objective answers to help the mission client make informed decisions. You’ll provide your customer with a deep understanding of their data, what it all means, and how they can use it. Join us as we use data science for good.  Empower change with us.
Build Your Career:At Booz Allen, we know the power of analytics and we’re dedicated to helping you grow as a data analysis professional. When you join Booz Allen, you can expect:access to online and onsite training in data analysis and presentation methodologies, and tools like Hortonworks, Docker, Tableau, and Splunk
a chance to change the world with the Data Science Bowl—the world’s premier data science for social good competition
participation in partnerships with data science leaders, like our partnership with NVIDIA to deliver Deep Learning Institute (DLI) training to the federal government
You’ll have access to a wealth of training resources through our Analytics University, an online learning portal specifically geared towards data science and analytics skills, where you can access more than 5000 functional and technical courses, certifications, and books. Build your technical skills through hands-on training on the latest tools and state-of-the-art tech from our in-house experts. Pursuing certifications? Take advantage of our tuition assistance, on-site bootcamps, certification training, academic programs, vendor relationships, and a network of professionals who can give you helpful tips. We’ll help you develop the career you want, as you chart your own course for success.
You Have:-Experience with using technical and analytical work to explore and examine data from multiple disparate sources with the goal of discovering patterns and previously held insights that can provide a competitive advantage or identify and address a pressing business problem-Ability to analyze and implement analysis infrastructures and tools, analytic workflow processes, and complex data visualizations-Ability to supervise the activities of teammates-TS/SCI clearance with a polygraph-BA or BS degree
Nice If You Have:-10+ years of experience in a professional work environment-Knowledge of data modeling and forecasting-BS degree in Mathematics, Statistics, or CS preferred
Clearance:Applicants selected will be subject to a security investigation and may need to meet eligibility requirements for access to classified information; TS/SCI clearance with polygraph is required.We’re an EOE that empowers our people—no matter their race, color, religion, sex, gender identity, sexual orientation, national origin, disability, or veteran status—to fearlessly drive change.CMD"
"151",151,"Data Science/Operations Research Analyst, Mid","Consulting","Job Number: R0040492Data Science/Operations Research Analyst, MidKey Role:Apply operations research and data science techniques across a wide range of military problems, including acquisition, personnel, operations, and strategic planning. Explore and examine data from multiple disparate sources with the goal of discovering patterns and previously hidden insights. Provide modeling and simulation support. Define problems, build models, identify performance measures, and perform gap and root cause analyses. Develop and implement machine learning, data mining, and statistical and graph-based algorithms to solve large-scale, complex, and challenging problems across the DoD. Leverage analytical and technical expertise, including operations research, engineering, mathematics, statistics, and computer science.
Basic Qualifications:-Experience with programming languages, including Java, C++, C#, VBA, and Python-Experience with statistical analysis, including descriptive and inferential statistics, probability theory, predictive modeling, data sampling, and a variety of statistical tests and procedures-Secret clearance required-BS degree in Operations Research, Management Science, Applied Mathematics, Statistics, Engineering, or CS
Additional Qualifications:-Knowledge of DoD, DON, and USMC Planning, Programming, Budgeting, and Execution (PPBE) processes-Knowledge of authoritative DoD, DON, and USMC databases-Possession of excellent oral and written communication skills
Clearance:Applicants selected will be subject to a security investigation and may need to meet eligibility requirements for access to classified information; Secret clearance is required.We’re an EOE that empowers our people—no matter their race, color, religion, sex, gender identity, sexual orientation, national origin, disability, or veteran status—to fearlessly drive change."
"152",152,"Data Scientist","Consulting","Job Number: R0037495Data ScientistThe Challenge:Are you excited at the prospect of unlocking the secrets held by a data set? Are you fascinated by the possibilities presented by the IoT, machine learning, and artificial intelligence advances? In an increasingly connected world, massive amounts of structured and unstructured data open up new opportunities. As a data scientist, you can turn these complex data sets into useful information to solve global challenges. Across private and public sectors — from fraud detection, to cancer research, to national intelligence — you know the answers are in the data.
We have an opportunity for you to use your analytical skills to support Army modernization. You’ll work closely with your customer to understand their questions and needs, and then dig into their data-rich environment to find the pieces of their information puzzle. You may develop algorithms, write scripts, build predictive analytics, use automation, apply machine learning.  You will use the right combination of tools and frameworks to turn that set of disparate data points into objective answers to help military leaders make informed decisions. You’ll provide your customer with a deep understanding of their data, what it all means, and how they can use it. Join us as we use data science for good.
Empower change with us.
Build Your Career:At Booz Allen, we know the power of analytics and we’re dedicated to helping you grow as a data analysis professional. When you join Booz Allen, you can expect:access to online and onsite training in data analysis and presentation methodologies, and tools like Hortonworks, Docker, Tableau, and Splunk
a chance to change the world with the Data Science Bowl—the world’s premier data science for social good competition
participation in partnerships with data science leaders, like our partnership with NVIDIA to deliver Deep Learning Institute (DLI) training to the federal government
You’ll have access to a wealth of training resources through our Analytics University, an online learning portal specifically geared towards data science and analytics skills, where you can access more than 5000 functional and technical courses, certifications, and books. Build your technical skills through hands-on training on the latest tools and state-of-the-art tech from our in-house experts. Pursuing certifications? Take advantage of our tuition assistance, on-site bootcamps, certification training, academic programs, vendor relationships, and a network of professionals who can give you helpful tips. We’ll help you develop the career you want, as you chart your own course for success.
You Have:-Experience with applying advanced analytic techniques, including natural language processing and machine learning-Experience with building data products using open source programming languages, including Python, R, TensorFlow, and ElasticSearch-Experience with scaling data products across distributable computing environments, including Hadoop, MapReduce, or MongoDB-Secret clearance-BA or BS degree in CS, Computer Engineering, or Systems Engineering
Nice If you Have:-TS/SCI clearance preferred-MA or MS degree a plus
Clearance:Applicants selected will be subject to a security investigation and may need to meet eligibility requirements for access to classified information; Secret clearance is required.We’re an EOE that empowers our people—no matter their race, color, religion, sex, gender identity, sexual orientation, national origin, disability, or veteran status—to fearlessly drive change.#LI-AH1, CB13, CJ1, GD13, MPPC"
