"","job_id","jobbank..Job.Title.","industry","jobdesc"
"71",71,"Data Strategist, Senior","Consulting","Job Number: R0034372Data Strategist, SeniorKey Role:Comprehend data and data management from an enterprise architecture view and translate business-oriented information requirements into technical data management solutions by developing and implementing enterprise data strategies for the management and sharing of data that enables more effective cross-enterprise and inter-enterprise system interoperability. Ensure that enterprise data assets are governed by a comprehensive data management approach. Leverage knowledge and expertise in database design, data modeling, data integration, modern data implementations, big data tools, and data exchange standards.
Basic Qualifications:-7+ years of experience in data strategy work-7+ years of experience with general management consulting-Experience with supporting Agile or Systems Development Life Cycle (SDLC) processes-Experience in engaging with clients to capture and prioritize business needs-Experience with reporting and tracking requirements-Experience with designing and analyzing performance metrics-Ability to travel to the client site in New Carrollton, MD 3 days per week with periodic travel to local offices in the DC Metro Area, including Washington, DC, McLean, VA, and Rockville, MD-BA or BS degree
Additional Qualifications:-Experience with presenting material to senior division, program, and government officials-Ability to astutely operate in uncertain environments with authority and influence-Ability to emphasize methodology, modeling, and governance while remaining technologically and politically neutral-Ability to be articulate, persuasive, and enthusiastic with a knack for good storytelling-Ability to explain advanced concepts to team members, users, and clients-Ability to work independently and address ad-hoc challenges-Ability to be resourceful and perform desk research-Ability to demonstrate domain expertise, business acumen, program management, resource allocation, collaboration and teamwork, data science consulting, ethics, and integrity-Ability to demonstrate inductive and deductive reasoning-Ability to demonstrate perseverance, innovation and creativity, resilience and hardiness, inquisitiveness, adaptability or flexibility, ambiguity tolerance, detail-orientation, self-confidence, and strong work ethic-Ability to obtain a security clearance-Possession of excellent oral and written communication skills-Possession of excellent critical thinking and problem-solving skillsWe’re an EOE that empowers our people—no matter their race, color, religion, sex, gender identity, sexual orientation, national origin, disability, or veteran status—to fearlessly drive change."
"72",72,"Senior Data Scientist (Marketing)","Other Great Industries","The OpportunityVivid Seats is the largest independent online ticket marketplace, sending 40,000 fans to live events every day. Working at Vivid Seats puts you front and center at the opportunity to scale our best in class platform that allows our fans to sit closer and see more.At Vivid Seats, you will have the opportunity to work with flexibility and the speed of a startup while operating at a massive, profitable scale. We keep our teams lean, giving every single employee direct accountability in creating a positive ticket buying experience. We are relentless and move quickly to release new features and content to the site and mobile app daily. Your ideas are heard and implemented, your hard work rewarded. Being a part of our team means that have the ability to drive impact and own the innovation that allows us to connect our tens and millions of unique monthly users to the memorable experiences that live events create.As the Senior Data Scientist, you will have a direct and measurable impact on growth and profitability by developing, improving, and testing algorithms to drive customer acquisition and retention. You’ll be a vital member of the CRM team, creating analytical models and triggered programs that deliver relevant offers and personalized recommendation to Vivid Seats’ customers. You’ll explore diverse sets of user-generated data, and will and use sound scientific principles to create precise, high-performing and reliable models to be used in our marketing campaigns. The systems you build will affect Vivid Seats’ customer experience (email, push notifications, paid search, etc).You will wake up every day obsessed with utilizing data analysis to drive channel growth and deliver the best messaging to our existing and prospective customers. You will have the opportunity to work cross-functionally to distill and present complex learnings and to be an advocate of analytical, data-driven decision making across the company.To be successful, you’ll needExperience developing insights from large datasets using various analytical methods such as predictive learning, regression methods, clustering, statistical forecasting, etc.
In-depth understanding of statistics and experiment design - control vs. variations, multivariate experiments, etc.
To quickly evaluate complex issues and solve business challenges with analytic solutions
Advanced experience using SQL for relational databases
To collect, organize, and analyze large amounts of data from a variety of sources using clear, well-documented, and understandable methodology
To be a strong communicator, mentor, and team player - you will collaborate closely with peers and cross-functional teams. 
To understand the drivers of our business, and to be able to explain your approach, test plans, and learnings to a wide variety of both technical and non-technical stakeholders
A proactive and energetic personality - you’ll need to multitask and prioritize projects independently
Creativity, fearlessness and an unwavering commitment to putting the customer first, elevating your team and ownership over outcomes
5-7 years of data engineering or data science experience in R; SAS and Python are a plus"
"73",73,"Data Scientist IV","Retail","Looking for a Data Scientist to join the Supply Chain team.We develop sophisticated algorithms that involve learning from large amounts of past data, such as actual sales, prices, promotions, similar products and product's attributes, in order to forecast the demand. We also work closely with Inventory Management, Supply Chain and Logistics teams to optimize our inventory allocation in our worldwide channels given operational constraints.Scope of Responsibility: Design algorithms and develop scalable solutions and models that allow for analyzing trends and scenarios in Inventory Management, Supply Chain and Logistics. Partner with organizational business process owners to leverage and implement the solutions that the team designs.Job Summary: Help lead the innovation and advancement of solutions to complex supply chain and inventory management problems using predictive analytics, data mining, mathematical programming, machine learning, and data visualization.Job Duties/Responsibilities:Work closely with fellow data scientists, data engineers, and project managers
Develop complex algorithms and data mining processes as well as optimization and simulation models to create new policies, evaluate their performance, and quantify their benefits and impacts to cost, reliability, and speed of the SHC fulfillment network using a variety of methods in data science, machine learning, and applied mathematics
Present findings to relevant business unit leaders and work with business partners to integrate them into our product plans
Develop new strategies to improve the performance of SHC's fulfillment systems networks
Research, evolve and innovate scientific methods and advanced business logic within our assortment, replenishment and/or supply chain planning teams
Job Requirements:Advanced degree in Industrial Engineering, Statistics, Mathematics, Economics, Computer Science, or similar technical field
Statistics and probability, particularly the application in systems analysis
Strong modeling, mathematical programming, and data visualization skills
Strong problem solving and data analysis skills
Experience in developing and applying advanced quantitative techniques toward solving business and information/technology problems
Working knowledge/experience with supply chain management - research experience in multiple areas is highly preferred
Able to work in a fast, collaborative environment, working with fellow scientists and data engineering teams for timely delivery of products
Experience with relational databases and SQL
Preferred Skills:Experience deploying data science solutions to the business environment
Experience in open source programming languages for large-scale data analysis, Python/Spark and R preferred
Experience with machine learning
Experience with Big Data concepts and technologies (Hadoop, AWS, GCP) "
"74",74,"Services Data Scientist","Other Great Industries","Agilent inspires and supports discoveries that advance the quality of life. We provide life science, diagnostic and applied market laboratories worldwide with instruments, services, consumables, applications and expertise. Agilent enables customers to gain the answers and insights they seek ---- so they can do what they do best: improve the world around us. Information about Agilent is available at www.agilent.com.
Agilent Technologies Services and Support Division is looking for an exceptional Data Scientist to join the Services Data Analytics team. Our team is responsible for providing analytical insights to business problems, data modeling, predicting future performance, and providing prescriptive, actionable strategy to the organization.
As a vital member of the growing Services Data Analytics team, you will be responsible for developing analytics utilizing tools (Qlik, R, SQL, JavaScript) and algorithms to draw deep analytical insights for managing the business in one of the following focus areas: profitability, channel effectiveness, customer journey, marketing, finance or resource planning. You should have experience operating in enterprise software suites (SAP or Oracle) and demonstrated strength in data visualization best practices to design intuitive, insightful analytics for users with various technical backgrounds.
To be excellent in this position, the candidate will need to perform in a Venn diagram that includes the art of design, mathematics, statistics, programming, business acumen and people skills.
Responsibilities:
Utilize communication skills to work across departments to enable strategic direction by translating Services business problem statements into data analysis projects
Optimize data retrieval and develop dashboards, reports and other visualizations for stakeholders to draw out key insights and trends
Identify ways to improve data reliability, efficiency and quality
Conduct research for industry and business questions
Deploy sophisticated analytics programs, machine learning and statistical methods for Agilent's service business engagement model
Deliver updates to stakeholders based on analytics
Provide analytics that enable the Service organization to more effectively draw deep analytical insights for managing the business in one of the following focus areas: profitability, channel effectiveness, customer journey, marketing or resource planning.
Propose new analytics to more effectively spot trends and anomalies in large data sets
Effectively communicate the health of the business through data visualization tools
"
"75",75,"Lead Data Scientist","Other Great Industries","Overview

Join our team of more than a hundred software engineers, designers, project managers and software specialists that are smart, creative and excited by what they do.Some of our ground-breaking work includes:• advanced computer-adaptive algorithms (only one that’s peer-approved in the country)• mobile support for the user interfaces• learning management systems with social media features• user interfaces that are universally accessible to people with or without disabilities • innovative, machine-scorable itemsThe American Institutes for Research (AIR) is a leading professional services firm with a growing software engineering and product development team. We design and build things that are inspiring and make a real impact in the online testing industry. We are currently seeking a Lead Data Scientist to join our team in the Washington, DC office.
Responsibilities

• Work as a member of AIR’s Assessment division on cutting edge problems involving the use of machine learning, data analytics and AI• Develops software, algorithms and applications to apply mathematics to data and build data driven apps to translate data into computational intelligence around standardized tests for students• Processes large amounts of data for statistical modeling, and graphic analysis (metrics)• Applies mathematical theories and statistical methods to solve problems in computer science• Develops mathematical or statistical models of phenomena to be used for analysis or computational simulation• Designs complex metrics projects that apply valid scientific techniques and utilize information obtained from baselines or historical data in order to structure analyses• Build prototypes that can be seamlessly transitioned to production• Develops algorithms for data analysis• Apply state of the art machine learning techniques
Qualifications

• MS in Applied Mathematics, Statistics, Computer Science, Physics or Engineering and 8+ years of experience or a Bachelor's Degree in the above fields and 10+ years of experience• Demonstrated ability and understanding of data mining and machine learning algorithms• Experience with numerical methods • Background in deep learning, machine learning & big data• Experience designing systems using Python, R, Java or .NET languages• Hands-on experience with using machine learning frameworks such as Scikit-learn and a deep learning framework such as TensorFlow, Keras, Caffe, PyTorch or Theano• Must possess an analytical mindset and strong programming skills• Experience working on large data sets• Experience working with relational databases such as SQL Server• Strong written and oral communication skills, organizational skills, and attention to detail• Self-motivated with minimal oversight• Experience with deep learning models performing NLP tasks a plus*LI-SS1#CB"
"76",76,"Data Scientist","Other Great Industries","Overview
Contribute to a Safer, More Secure, and More Sustainable World At UL, we know why we come to work. Thousands of us around the world wake up every day with one common purpose – to make the world a safer, more secure, and more sustainable place to live. We clear the way for our customers to introduce the latest products, technological advances, and systems in an increasingly complex world so they can provide peace of mind to the market. Our integrity is woven throughout our company and shapes the way we approach and deliver our solutions. We are proud that the work we do every day has a meaningful contribution to society. We continue to build upon our legacy of trusted expertise and partnership to keep our communities safe and secure as we march forward into the future. This helps us to sleep better at night, and we are confident that the millions of people we touch rest easier too. #ThisIsOurNormal

Responsibilities

Uses advanced mathematical and statistical concepts and theories to collect and analyze data and construct solutions to complex business problems. Performs advanced statistical analysis on experimental or business data to identify, validate and quantify trends or patterns based on guidance from business or research leaders. Constructs advanced predictive models, algorithms and probability engines to support data analysis or product functions; verifies model and algorithm effectiveness based on real-world results. Designs experiments and methodologies to generate and collect data for business use.  JOB RESPONSIBILITIES:  Identifies what data is available and relevant, including internal and external data sources, leveraging new data collection processes such as sensors, open data, and social media feeds. 
 Designs experiments, tests hypotheses, and builds models to explore complex business and safety science systems. 
 Conducts data analyses using traditional and complex statistical methods. Designs algorithms and implements software to perform analyses. 
 Aggregates, transforms and integrates multiple data sets to test hypothesis, model complex systems and identify patterns. Prepares and analyzes program/model output to allow for efficient data analysis. 
 Transforms complex data and results into creative graphs, tables, charts and other graphics to present and/or share the data in a compelling and concise manner. 
 Writes methodology, analysis and data insights for research papers, proposals and presentations. Synthesizes all aspects of a data science project to lead non-technical audiences through the goals, methods and implications of the project. 
 Works with business leaders and researchers to suggest other projects and initiatives that will advance the organizations goals. 
 Performs other duties as directed. 

Qualifications

University Degree (Equivalent to Bachelor’s degree) in Mathematics, Statistics, Computer Science or a related discipline plus generally 3-5 years of experience in statistical analysis or data science. 
Solid technical knowledge and experience working with R, SAS, Java or Python programming language. Several years’ experience manipulating large datasets and using databases with experience in general purpose programming language such as Hadoop. 
Ability to develop solutions to loosely defined business or research problems by leveraging pattern detection over large data sets. 
Experience using machine learning algorithms. 
Strong interpersonal skills with the ability to communicate with technical and non-technical internal and stakeholders. 
Ability to organize, analyze and correlate data information. 
#CB"
"77",77,"DATA SCIENTIST - SENIOR","Other Great Industries","Our client is currently seeking a DATA SCIENTIST - SENIOR 
Title:                    Sr. Data Scientist Duration:            15+ Months (Potential for Extension) Location:             Creve Coeur, MO 63141   Summary:  Design, implement and optimize statistical and machine learning models based on structured and unstructured data.  Collaborate with system integration and data warehouse engineers on data extraction and data cleaning.  Develop powerful analytics insights from geographical, marketing, industrial data and public policy using advanced machine learning techniques.  Work closely with the software engineering team to productize analytic software, using statistical programming languages like R and Python.  Work in a highly interactive, team-oriented environment.  Master's degree in a STEM field, with statistics courses or proven expertise, and 2 years of experience.  MUST HAVE: conceptual knowledge of statistics and basic theory"
"78",78,"Data Scientist (Python, R, Machine Learning)","Computer Software","We are looking for a Data Scientist that will help us discover the information hidden in vast amounts of data, and help us make smarter decisions to deliver even better solutions. Your primary focus will be in applying data mining techniques, doing statistical analysis, and building high quality prediction systems integrated with our processes.

You will be able to grow in competences on both the technical side of by working with Senior level members of the team participating in development and implementation of Big Data projects. You will be in charge of pure Data Scientist tasks with a focus on OCR and Computer vision by building a smart solution of document processing to generate analytics.
Selecting features, building and optimizing classifiers using machine learning techniques (R, Python).
Data mining using state-of-the-art methods.
Extending company’s data with third party sources of information when needed.
Enhancing data collection procedures to include information that is relevant for building analytic systems.
Processing, cleansing, and verifying the integrity of data used for analysis.
Doing ad-hoc analysis and presenting results in a clear manner.
Creating automated anomaly detection systems and constant tracking of its performance.

Job Requirements

College degree (Bachelor’s or higher) from accredited institutions in Data Science, Computer Science or relevant related field.
2-3 years of experience
Experience in Spark and Spark Streaming.
Experience with DataViz tools (Tableau, SpotFire) and Data Science tools (R, Python).
Excellent understanding of machine learning techniques and algorithms, such as k-NN, Naive Bayes, SVM, Decision Forests, etc.
Experience in Hadoop (Cloudera, HortonWorks and/or MapR) Architecture, Deployment and Development.
Experience with common data science toolkits, such as R and Python. Excellence in at least one of these is highly desirable
Strong communication skills
Experience in Data Engineering tools and techniques -Map Reduce, pig, Hive, Hbase, Oozie, Spark, solr.
Good applied statistics skills, such as distributions, statistical testing, regression, etc.
Experience in OCR technics and Computer vision.

Full-Time opportunity along with competitive benefits within the market."
