"","job_id","jobbank..Job.Title.","industry","jobdesc"
"226",226,"Machine Learning/Data Engineer-160k-Chicago","Computer Software","Machine Learning/Data Engineer -Chicago, IL Location: USA, Chicago, ILSalary: Competitive base salary + Company Equity + Bonuses + full medical benefits +profit sharing+ remote flexbility Technology: AWS Big Data JobsJob Type: Full time PermanentDate Posted: October 11, 2018My client is seeking a Data Engineer to join the team that brings solutions to clients through our services and technology. In this role, you will gain exposure to a wide variety of tasks and technology including development, diagnosis, deployment, and operations -- a great opportunity for someone with good understanding data management. You will become an expert in our data domains, act as a trusted advisor to architects and engineers, and become a crucial part of the deployment and operations of our systems. Ideal Candidate and should demonstrate the following skills:Software engineering or other technical discipline (or equivalent work experience)
3-8 years of data engineering, data science support experience, or software engineering * Object-oriented and functional programming and testing patterns
Engineering (commercial or open source) software platforms and large-scale data infrastructures * Strong knowledge in multiple programming languages:
Spark
Scala or Python
Kubernetes
Kafka
Akka (nice to have)
plus any others
Significant knowledge of data modeling and understanding of different data structures and their benefits and limitations under various use cases
Deployment in cloud/container environments.
Demonstrate strong problem-solving abilities, interpersonal communication skills
 Benefits & BonusFull medical/health insurance (employee and family)
Company Match 401k program/Stock Options/Bonus
Paid Metro Pass
Paid Certifications
PTO, plus Sick time
Massive opportunity for growth and career advancement
If you or someone you know is interested in this position, please send your resume directly to [Click Here to Email Your Resumé] or please call (John Kelly) 212-731-8282. My client is looking to start the interview process as soon as possible and the job will not be available long please act fast. Jefferson Frank is a leader in Niche IT Recruitment with a focus on cloud technologies including Azure & AWS, as well as Big Data, Data Science and BI. We deal with both Microsoft Partners, AWS partners & End Users throughout North America. We have open positions and relationships with some of the top partners and end users throughout the US and offer some excellent opportunities in the BI, Big data space. I understand the need for discretion and would welcome the opportunity to speak to any Big Data and cloud analytics candidates that are considering a new career or job either now or in the future. Confidentiality is of the upmost importance. For more information on available BI jobs, as well as the Business Intelligence, Big data and cloud market, I can be contacted at 212-731-8282. Please see www.jeffersofrank.com for more information.

Job Requirements

Machine Learning/Data Engineer -Chicago, IL Location: USA, Chicago, ILSalary: Competitive base salary + Company Equity + Bonuses + full medical benefits +profit sharing+ remote flexbility Technology: AWS Big Data JobsJob Type: Full time PermanentDate Posted: October 11, 2018My client is seeking a Data Engineer to join the team that brings solutions to clients through our services and technology. In this role, you will gain exposure to a wide variety of tasks and technology including development, diagnosis, deployment, and operations -- a great opportunity for someone with good understanding data management. You will become an expert in our data domains, act as a trusted advisor to architects and engineers, and become a crucial part of the deployment and operations of our systems. Ideal Candidate and should demonstrate the following skills:Software engineering or other technical discipline (or equivalent work experience)3-8 years of data engineering, data science support experience, or software engineering * Object-oriented and functional programming and testing patternsEngineering (commercial or open source) software platforms and large-scale data infrastructures * Strong knowledge in multiple programming languages:SparkScala or PythonKubernetesKafkaAkka (nice to have)plus any othersSignificant knowledge of data modeling and understanding of different data structures and their benefits and limitations under various use casesDeployment in cloud/container environments.Demonstrate strong problem-solving abilities, interpersonal communication skills Benefits & BonusFull medical/health insurance (employee and family)Company Match 401k program/Stock Options/BonusPaid Metro PassPaid CertificationsPTO, plus Sick timeMassive opportunity for growth and career advancementIf you or someone you know is interested in this position, please send your resume directly to [Click Here to Email Your Resumé] or please call (John Kelly) 212-731-8282. My client is looking to start the interview process as soon as possible and the job will not be available long please act fast. Jefferson Frank is a leader in Niche IT Recruitment with a focus on cloud technologies including Azure & AWS, as well as Big Data, Data Science and BI. We deal with both Microsoft Partners, AWS partners & End Users throughout North America. We have open positions and relationships with some of the top partners and end users throughout the US and offer some excellent opportunities in the BI, Big data space. I understand the need for discretion and would welcome the opportunity to speak to any Big Data and cloud analytics candidates that are considering a new career or job either now or in the future. Confidentiality is of the upmost importance. For more information on available BI jobs, as well as the Business Intelligence, Big data and cloud market, I can be contacted at 212-731-8282. Please see www.jeffersofrank.com for more information."
"227",227,"Data Science Intern","Other Great Industries","Every day at Perspecta, we enable hundreds of thousands of people to take on our nation’s most important work.  We’re a company founded on a diverse set of capabilities and skills, bound together by a single promise: we never stop solving our nation’s most complex challenges.  Our team of engineers, analysts, developers, investigators, integrators and architects work tirelessly to create innovative solutions.  We continually push ourselves—to respond, to adapt, to go further.  To look ahead to the changing landscape and develop new and innovative ways to serve our customers.Perspecta works with U.S. government customers in defense, intelligence, civilian, health care, and state and local markets. Our high-caliber employees are rewarded in many ways—not only through competitive salaries and benefits packages, but the opportunity to create a meaningful impact in jobs and on projects that matter. Perspecta’s talented and robust workforce—14,000 strong—stands ready to welcome you to the team. Let’s make an impact together.Perspecta is an AA/EEO Employer - Minorities/Women/Veterans/Disabled and other protected categories

Responsibilities

Our intern program is designed to provide college students the opportunity to learn about Perspecta and gain meaningful, hands-on work experience in a professional environment.  Perspecta’s summer internship program places an emphasis on developing the next generation’s workforce. This being said, as part of our internship curriculum we provide the opportunity for each intern to interact with various branches of the company. This includes the chance to participate in a corporate public speaking course, complete technical certification training courses, attend brown bag sessions with our executive leadership team and participate in teambuilding activities with mentors and fellow interns. Our culture of mentoring, continuous learning and team orientation will be obvious from your first day on the job. Our goal is to build a roadmap that leads you to a long, rewarding and challenging career with Perspecta. We work with you to determine your desired career path, and the correct steps to get you to your goals. At the end of the program each intern will give a brief presentation to our executive team summarizing their accomplishments and key takeaways achieved while working for us.    Co-Op / Interns typically represent college students trying to gain related work experience while pursuing an undergraduate degree. Under direct supervision, performs various hands-on tasks and assignments for the organization's professional staff in such disciplines as Engineering, Software Development, Database Management, Security Threat Analysis.    Internship Advantages: -Meaningful work related to national security -Primary channel for full-time, entry-level hires -Competitive pay -Opportunity for government security clearance -Interaction with executives -Organized professional development and social activities   This ten-week paid internship program runs from May 29 to August 3, with the option to extend.  We ask that each intern be available to work the duration of the ten weeks and commit to working a minimum of 30 hours per week. This program is geared towards technical college students, actively enrolled at a four year university, who will be rising into their senior year. Juniors may be considered if they have declared their major and have qualified coursework.   The Data Science Intern will research weather data applications and related data.


Job Requirements

Must be a US citizen. May be required to obtain a government security clearance. Must be actively pursuing a 4 year degree at an accredited university. Must be pursuing a degree in engineering, mathematics, business, information technology, computer science, or related fields. An ideal candidate will be a rising junior or senior. An ideal candidate will have a 3.0 cumulative GPA or higher. "
"228",228,"Senior Tableau Engineer","Entertainment, Hospitality, Accounting - Finance","Our Media client is seeking a qualified Senior Tableau Engineer with the following:
Strong enterprise Tableau skills, Data modeling/design, Visualizations for large datasets.
Experience with OLAP technologies and data analytics, implementing data quality.
Ability to present the visualizations/data ina inuitive, clear and concise manner.
Troubleshooting skills, capable of investigating and mastering new datasets.
Great communication, comfortable with partnering with the business.
Expert with SQL writing (Exposure to Python, R, Alteryx, or Java a plus)
Exposure to other reporting tools like QlikView or MicroStrategy a plus
An individual that has a Tableau Public page preferred.
Syfter places top talent from entry-level to C-suite in Information Technology positions for consultants, contract to hire, and full-time positions. We provide creative staffing solutions for start-ups, small to medium-sized businesses, enterprise-level companies, Fortune 500, and non-profit organizations.

Job Requirements

Our Media client is seeking a qualified Senior Tableau Engineer with the following:
Strong enterprise Tableau skills, Data modeling/design, Visualizations for large datasets.
Experience with OLAP technologies and data analytics, implementing data quality.
Ability to present the visualizations/data ina inuitive, clear and concise manner.
Troubleshooting skills, capable of investigating and mastering new datasets.
Great communication, comfortable with partnering with the business.
Expert with SQL writing (Exposure to Python, R, Alteryx, or Java a plus)
Exposure to other reporting tools like QlikView or MicroStrategy a plus
An individual that has a Tableau Public page preferred.
Syfter places top talent from entry-level to C-suite in Information Technology positions for consultants, contract to hire, and full-time positions. We provide creative staffing solutions for start-ups, small to medium-sized businesses, enterprise-level companies, Fortune 500, and non-profit organizations."
"229",229,"Installations Mission Capacity Analyst","Consulting","Job Number: R0040147Installations Mission Capacity AnalystKey Role:Capture mission critical information at Army National Guard (ARNG) training sites around the US and categorize the collected data into levels of quality. Provide army leadership with information and insights into identification of installation deficiencies, resource planning, and improving the quality and volume of mission at individual ARNG sites. Provide technical expertise, online system administration, and support to client, as they conduct data collection and data submission processes. Leverage knowledge of ISR-MC’s two program areas: Mission Support and current mission, sustainability and future mission. Provide recommendations and summaries to the ARNG Installation status report program manager and Guard Bureau. Serve as a subject matter expert on improving quality and accuracy of data reporting. Maintain current ISR-MC curriculum and provide training to Guard Bureau personnel and travel to States for training, as needed.
Basic Qualifications:-Experience with database management in Microsoft Excel and Access-Experience in data analytics, particularly knowledge of conducting trend and prediction analyses-Knowledge of military installations-Ability to provide efficient, effective, and timely oral and written communication to clients-Public Trust clearance-BA or BS degree
Additional Qualifications:-2 years of experience in working with Headquarters, Department of the Army (HQDA) installations and real property data systems
Clearance:Applicants selected will be subject to a security investigation and may need to meet eligibility requirements for access to classified information; Public Trust clearance is required.We’re an EOE that empowers our people—no matter their race, color, religion, sex, gender identity, sexual orientation, national origin, disability, or veteran status—to fearlessly drive change."
"230",230,"Financial Data Analyst","Accounting - Finance, Banking - Financial Services, Consulting","Ref ID: 03200-0010653829Classification: Financial Business AnalystCompensation: $42.00 to $47.00 per hourOur client, a public company in South Charlotte, is seeking a Senior Data Analytics Auditor for a 2-3 month project! Senior Data Analytics Auditor performs a variety of data analytics/continuous auditing and Business Intelligence Activities, traditional audit and assurance activities and IT audit. Plan, perform, evaluate, summarize and communicate assigned risk assessments and audit activities in a professional, competent, independent and objective manner in accordance with department standards. Extract and analyze operational and financial data sets and using data analytics concepts and tools (SQL, Access, Tableau), create data analytics, and Business Intelligence reports. Interested, qualified, immediately available, and LOCAL candidates, please send an updated version of your resume to [Click Here to Email Your Resumé]. No phone calls, please! We will reach out if your background aligns with the role!

Job Requirements

SQL - Structured Query Language, Tableau, MS Access, Audit, IT Audit, Analysis, Data or Gap Analysis, SOX - Sarbanes-Oxley CPA, SAP, prior public accounting experience (Big 4 preferred)Our industry-leading alliances and broad client network provide you greater access to a variety of unique interim and long-term project opportunities that can keep you continuously engaged. We also provide competitive benefits and compensation packages, as well as online training and continuing professional education (CPE). Our parent company, Robert Half, has appeared on Fortune® magazine's list of ""World's Most Admired Companies"" since 1998. At Robert Half Management Resources, your experience matters - and we put it to good use. To apply for this position or for more information on other engagements, visit us online at roberthalfmr.com or call your branch office at 1.888.400.7474.All applicants applying for U.S. job openings must be authorized to work in the United States. All applicants applying for Canadian job openings must be authorized to work in Canada.© 2018 Robert Half Management Resources. An Equal Opportunity Employer M/F/Disability/Veterans By clicking 'Apply Now' you are agreeing to Robert Half Terms of Use."
"231",231,"Data Science -2019 Summer Intern","Other Great Industries","We are an Equal Opportunity Employer and do not discriminate against any employee or applicant for employment because of race, color, sex, age national origin, religion, sexual orientation, gender identity, status as a veteran and basis of disability or any other federal, state or local protected class:Data Science- 2019 Summer Intern Schedule – 40 hours a week, Monday – Friday // May 27 – Aug 2, 2019SummaryAdvance Auto Parts (AAP) is a $10 billion after-market auto parts retailer serving millions of customers across the US and Canada. As part of the Advance AI team, you will be leading AAP's push to use cutting-edge computing and data science to optimize nearly every aspect of current operations to increase revenue, cut costs, and, most importantly, anticipate the needs of our customers. Think ahead. Think Advance.General Job ResponsibilitiesWork with large, complex data sets.  Solve difficult, non-routine analysis problems, applying advanced analytical methods as needed.  Conduct end-to-end analysis that includes data gathering and requirements specification, processing, analysis, ongoing deliverable and presentations.Build prototype analysis pipelines iteratively to provide insights at scale.  Develop comprehensive understanding of Advance’s data structure and metrics.Create end-to-end data science solutions, inclusive of advanced models and analytics, to translate data-driven insights into actionable outcomes.Work with the latest open source tools, libraries, platforms and languages to explore billions of customer records and external data sources for relationships and actionable insights.Partner across the enterprise to enable and share best practices and reusable and scalable tools and code for our data scientist, data engineers and data architectsWork with our user experience and software development teams to design rich data visualizations and interactive solutions to communicate complex ideas to customers and company leaders.

Qualifications:
Summer 2019 Rising Junior or Senior or first-year Masters student. Preferred Majors: Computer Science, Mathematics, Engineering or other relevant disciplines Some experience with a data science programming language (ex: R, SAS, and/or Python)


Job Requirements

We are an Equal Opportunity Employer and do not discriminate against any employee or applicant for employment because of race, color, sex, age national origin, religion, sexual orientation, gender identity, status as a veteran and basis of disability or any other federal, state or local protected class."
"232",232,"Finance Analyst","Other Great Industries","RESPONSIBILITIES:Kforce has a client in search of a Finance Analyst in Alpharetta, Georgia (GA).Summary:You gather disparate data from various data sources; analyze and normalize to ensure data integrity for analysis. You provide consistent, relevant, and accurate data as well as guidance/knowledge of the data and definitions that are available for analysis.Major Tasks, Responsibilities and Key Accountabilities: Serves as a resource to assigned client in area of expertise
 Gathers and compiles raw data; conducts research for industry trends and benchmarks; and normalizes data to be incorporated into a centralized data format
 Analyzes, reports, makes comparisons to industry/company benchmarks, determines trends, and prepares cost analyses
 Defines data definitions and documents data limitations
 Prepares spreadsheets for data analysis; prepare reports with charts and graphs, mailing lists, maps and ad hoc requests; May make presentations
 Provides recommendations based on findings and analysis; Provides input on policies and procedures
 Participates in department and interdepartmental projects
 Performs other duties as assigned
 May provide general guidance/direction to or train junior level support personnel or professional personnel
Work Environment: Most of the time is spent sitting in a comfortable position and there is frequent opportunity to move about; On rare occasions there may be a need to move or lift light articles
 Located in a comfortable indoor area; Any unpleasant conditions would be infrequent and not objectionable
 No travel required

Job Requirements

REQUIREMENTS: Demonstrates skill in data analysis techniques by resolving missing/incomplete information, inconsistencies/anomalies in more complex research/data
 Nature of work requires increasing independence; receives guidance only on unusual complex problems or issues; Work review typically involves periodic review of output by supervisor and/or direct ""customers"" of the process
Kforce is an Equal Opportunity/Affirmative Action Employer. All qualified applicants will receive consideration for employment without regard to race, color, religion, sex, pregnancy, sexual orientation, gender identity, national origin, age, protected veteran status, or disability status"
"233",233,"Associate Actuary","Insurance"," Certilytics offers a suite of innovative analytic solutions including Big Data Services, Total Population Health Management, Financial Risk Intelligence and Customized Prediction Models. These solutions are configured upon our open source Hadoop Platform, with the underlying philosophy of providing analytics as a service and moving beyond predictions to deliver actionable intelligence.   Our team represents a dynamic infusion of multidiscipline which includes actuarial, data and behavioral scientists, IT engineers, software developers, nurse clinicians, as well as experts in public health and the health insurance industry. Certilytics has extensive experience working with a diverse set of customers including large self-insured employers, health plans, pharmacy benefit managers, government programs, care management companies and health systems. These relationships with various data providers and customers allows for rapid data ingestion, validation and enrichment as well as streamlined delivery of analytic dashboards, outputs and visualizations to our customers.  Our unique approach allows for the development of the most accurate financial, clinical and behavioral models in the industry.  Actuaries are responsible for measuring and evaluating risk utilizing data analytics. They will also help us to design and build best in class products by evaluating and making recommendations for improving processes. If you are someone who doesn't shy away from rolling up your sleeves and diving in, this position may be for you.  Essential Function Participate in Product Design meetings, and assist in the product design, development and testing process  Manipulate and analyze complex, high-volume, high-dimensionality data from varying sources using a variety of tools and data analysis techniques  Provide expertise to customers and internally using Certilytic's advanced analytic techniques applied to actuarial, financial and underwriting concepts  Assist with the development of reports and projects, including documenting methodology, designing reporting, and making recommendations based upon data analysis  Identify complex healthcare data problems or issues, researches solutions, and implement steps to achieve higher level of efficiency for Certilytics analytic product offerings  Provides analytical support to the Product Design, Data Science, Clinical, Data Logistics, and Operational Teams  Conduct research and perform root cause analysis as part of responsibility for analytics projects All other duties as assigned.  Required Skills Requirements  Bachelor's degree in Actuarial Science, Mathematics, Economics, Statistics, Finance or related field. Fellow of the Society of Actuaries (FSA), Associate of Society of Actuaries (ASA) designation, or progressing towards ASA designation A minimum of 4 years actuarial experience. Strong knowledge of healthcare industry actuarial concepts, including trend, risk adjustment, care management, provider contracting, product pricing, underwriting principles and stop-loss. Understanding of healthcare operations from perspective of payer, PBM and provider. Proficiency with Microsoft Office and SQL. Strong actuarial, analytical and problem-solving skills. Knowledge of Medicare and Medicaid lines of business preferred Strong organizational and prioritization skills. Strong interpersonal and communication (verbal & written) skills. Ability to communicate business and technical information to people of various backgrounds. Stays current with profession's continuing education requirements. Ability to work under pressure and tight deadlines.  Job Location Louisville, Kentucky, United States Position Type Full-Time/Regular"
